question_id,question,opa,opb,opc,opd
1,Hairy cell leukemia&; is a Neoplastic proliferation of :,T. cells,B. cells,Myeloid cells,Macrophages
2,Autonomous hyperplasia is seen in-,Choristoma,Endometrial hyperplasia,Fibromatosis,Hamaoma
3,Irreversible cell injury is indicated by -,Accumulation of calcium in mitochondria,Myelin figures,ATP depletion,Shifting of ribosomes
4,The removal of malarial parasites from the red blood,Pitting,Culling,Binding,Phagocytosis
5,Large Intracytoplasmic glycogen storage is seen in which of malignancy,Ostersarcoma,Mesenchymal chondrosarcoma,Ewing's sarcoma,Leiomyosarcoma
6,Bence Jones Protein are -,Heavy chains,Heavy & light chain,Light chain,Immunoglobulin
7,Most common parotid tumor -,Pleomorphic adenoma,Adenocystic carcinoma,Epidermoid tumor,Adenocarcinoma
8,"A 50-year, old patient tSCIILS wnn n1 ea i-,ess and bleeding episodes. His leukocyte count was 48 x 109 cells/L and platelet count was 50 x 109 cells/L. There was dysplasia of neutrophils with a differential count showing 76% neutrophils, 8% blast cells, 12% myelocytes and metamyelocytes and 4% other cells Bonemarrow examination showed 14% blasts. Cytogenetics showed t(8, 21). The most likely diagnosis is:",Acute myeloid leukemia,Chronic myeloid leukemia,Chronic lymphoid leukemia,Myelodysplastic syndrome
9,"Most common presentation of gastrinoma/ZES:March 2013 (f, h)",Abdominal pain,Duodenal ulcer,Weight loss,Nausea
10,Most common extranodal site for non-hodkin's lymphoma is -,Stomach,Brain,Intestines,Tonsils
11,Which of the following is the gene for Duchenne muscular dystrophy?,STK11 gene,PTCHgene,DMPKgene,Dystrophin gene
12,Most common antecedent of erythroplakia and leukoplakia is-,Diphtheria,Tobacco use,Alcohol,Poor oral hygiene
13,Natural killer cells attacks which of the following cells MI-,Cells which express MHC 1,Cells which are not able to express MHC 1,MHC cells which express MHC 2,Cells which are not able to express MHC
14,Which of the following has a Direct role in Apoptosis.,NO,Adenyl cyclise,C AMP,Cytochrome C
15,Causative agent of Farmer's lung is:,Themophilus actinomycetes,Aspergillus,Penicilliumglabrum,Rhizopus
16,Thrombomodulin thrombin complex prevents clotting because -,Thrombomodulin inhibits prothrombin activator,The complex activates antithrombin III,Thrombomodulin-thrombin complex activates heparin,The complex removes thrombin and also activates protein kinase 'C' which inactivates factors V & VIII
17,Nesidioblastoma is due to hyperplasia of?,Alpha cell,Beta cell,Acinus,D cells
18,Raspberry tongue is seen in,Scarlet fever,Vitiligo,Vitamin B12 deficiency,Impetigo
19,AML with worst prognosis -,8/12 translocation,Inversion 16,Normal cytogenetics,Monosomy 7
20,"In granuloma, epithelial and giant cells are derived from:",T cells,B cells,Plasma cells,Monocyte
21,Type of inheritance of Wilson desease is?,Autosomal dominant,Autosomal Recessive,X Linked dominant,X Linked recessive
22,Protector or inhibitor of Apoptosis,BCL-2,BRCA,RB,TGF –β
23,A middle aged woman presented with fishy odour vaginal discharge shows 'clue cells' in a wet preparation. She probably has:,Bacterial vaginosis,Chlamydia trachomatis,Neisseria gonorrhoeae,Trichomonas
24,Which of the following is not the karyotype of turners syndrome?,"46,X, i(X) (q10)",45 XO,"46 XX, i(Xp)","46,X,r(X)"
25,A scientist Dr. Gobind was asked to paicipate in a research project on myocardial infarctions in a rabbit model. Which of the following occurs in ischemic cell injury?,Efflux of K+ and Na+,Influx of K+ and Ca++,Influx of K+ and H 2O,Influx of Na+ and Ca++
26,Origin of lymphoplasmacytic lymphoma is from:-,Germinal centre T cell,Germinal centre B cell,Post germinal centre B cell,Pre germinal centre B cell
27,Characteristic finding in muscular dystrophy is -a) Inflammatory cell infiltrateb) Heterogenicity of fiber sizec) Nuclear proliferation beneath sarcolemmad) Muscle necrosis,c,d,ab,bd
28,Conjugated hyperbilirubinemia is seen in,Gilbe's syndrome,Dubin Johnson syndrome,Crigler Najjar syndrome,Breast milk jaundice
29,Marker of T lymphocyte,CD 8,CD 19,CD 20,CD 45
30,In malignant hyperthermia the increased heat production is due to :,Increased muscle metabolism by excess of calcium ions,Thermic effect of food,Increased sympathetic discharge,Mitochondrial thermogenesis
31,Major contribution to cachexia with advanced cancer?,Clathrin,Histamine,Interferon,Tumor-necrosis-factor (TNT)
32,"A 21-year-old woman presents with a 3-month history of malaise, joint pain, weight loss, and sporadic fever. The patient appears agitated. Her temperature is 38degC (101degF). Other physical findings include malar rash, erythematous pink plaques with telangiectatic vessels, oral ulcers, and non blanching purpuric papules on her legs. Laboratory studies show elevated levels of blood urea nitrogen and creatinine. Antibodies directed to which of the following antigens would be expected in the serum of this patient?",C-ANCA (anti-proteinase-3),Double-stranded DNA,P-ANCA (anti-myeloperoxidase),Rheumatoid factor
33,Formation of granulation tissue is due to ?,Thrombosed vessels,Budding of new capillaries,Mucosal proliferation,Infiltration of cells
34,Dithionite test is done for assessing -,Hb F,Hb E,Hb A,Hb S
35,A 40 year old female patient complains of weakness and loss of appetite. Patient is a known case of non-hodgkin’s lymphoma. Lymph node examination shows involvement of Waldeyer’s ring. The clinical staging for this  patient is?,Stage I,Stage II,Stage III,Stage IV
36,Which of the following is a causative agent of Farmer's Lung?,Thermophilic Actinomycetes,Aspergillus Fumigatus,Actinobacter,Aspergillus Flavus
37,Which of the following condition masks low serum haptoglobin in hemolysis?,Bile duct obstruction,Liver disease,Malnutrition,Pregnancy
38,A young female patient came for routine examination. On examination a mid systolic click was found. There is no history of RHD. The histopathological examination is most likely to show-,Myxomatous degeneration and prolapsed of the mitral valve,Fibrinous deposition on the tip of papillary muscle,Rupture of chordae tendinae,Aschoff nodule on the mitral valve
39,"A 36-year-old, alcoholic woman presents with a 1-week history of yellow skin and sclerae. She has suffered persistent headaches. Her vital signs are normal. Physical examination reveals jaundice. Laboratory studies disclose markedly elevated levels of AST and ALT (956 and 1,400 U/L, respectively). A few days later, she develops hepatic encephalopathy and renal failure. A liver biopsy shows prominent centrilobular necrosis. Which of the following is the most likely diagnosis?",Acetaminophen toxicity,Fatty liver of pregnancy,Metastatic carcinoma,Reye syndrome
40,Histopatholoty of a lung cancer shows 'clara cells' probable diagnosis is -,Squamous cell cancer,Bronchio alveolar cancer,Large cell cancer,Papillary carcinoma
41,Most Common Valve Not involved in Rheumatic Fever:,Mitral,Aoic,Pulmonary,Tricuspid
42,Acquired mutations in PIGA  gene gives rise to :,Paroxysmal Nocturnal Hemoglobinuria,Hereditary Spherocytosis,Isoimmune hemolytic anemia,Fanconi’s anemia
43,Which of the following is not a free radical scavenger -,Glutathione peroxidase,Superoxide dismutase,Catalase,Xanthine oxidase
44,Pseudolaminar necrosis is a feature of -,Cerebral infarct,Renal infarct,Hepatic infarct,Cardiac infarct
45,Changes in which amyloid structure makes it insoluble?,Primary,Secondary,Tertiary,Quaternary
46,Most common cause of cellulitis of face is,Trauma,Abscess,Pericoronitis,Bacterial infection
47,The commonest site of lytic lesion in multiple myeloma is -,Vertebral column,Femur,Clavicle,Pelvis
48,Dimorphic carcinoma is -,Papillary carcinoma breast,Follicular carcinoma thyroid,Gastric adenocarcinoma,Endometrial carcinoma
49,Which of the following cardiac complications may develop in a 33 year old woman with systemic lupus erythematosus (SLE) because of her underlying condition?,Hemorrhagic pericarditis,Infective endocarditis,Libman-Sacks endocarditis,Mitral valve prolapse
50,Which one of the following is not a cause for restrictive cardiomyopathy -,Alcohol,Hemochromatosis,Amyloidosis,sarcoidosis
51,Preservative used in coagulation study is -,Calcium citrate,EDTA,Sodium bromide,Thrombin
52,Bronchial adenoma commonly present as -,Recurrent hemoptysis,Cough,Dysponea,Chest pain
53,Ground glass cells of Hadziyannis are seen in,Bone,Liver,Thyroid,Prostate
54,A 32-year-old patient has a pulmonary vascular resistance of 4 mm Hg/L per minute and a cardiac output of 5 L/min. What is her driving pressure for moving blood through the pulmonary circula on?,10 mm Hg,15 mm Hg,20 mm Hg,30 mm Hg
55,Community acquired pneumonia is most commonly caused by: September 2005 and March 2008,Staphylococcus aureus,Streptococcus pneumoniae,H.influenza,Klebsiella
56,The most radiosenstitive tissue is -,Brain,Bone marrow,Thyroid,Liver
57,Which is the most common location of the tumor glioblastoma multiforma?,Brainstem,CP angle,Frontal lobe,Temporal lobe
58,"Which of the following tumor arise from the mesenchymal portion of the tooth germ, either from dental papilla,the follicle or the PDL:",Odontogenic myxoma.,Adenomatoid odontogenic tumor.,Pindborg tumor.,Ameloblastoma
59,Apoptosis does not occur by normal capsase pathway in?,Liver,Muscle,Neurons,Skin
60,"In Lipooxygenase pathway, the formation of the arachidonic acids products which of the following helps in vasoconstriction and increased vascular permeability -",C5a,Thromboxane A2,Leukotriene D4,"C, activators"
61,Gluten free diet is used in,Celiac disease,Tropical sprue,Ulcerative colitis,Irritable bowel syndrome
62,A 3-year-old boy dies in an automobile accident. At autopsy the right lung is markedly shrunken. Dissection shows that the right main stem bronchus ends blindly in nondescript tissue composed of rudimentary ducts and connective tissue. This finding represents an example of which of the following errors of morphogenesis?,Aplasia,Atresia,Dysraphic anomaly,Hypoplasia
63,Heat stiffening occurs when person exposed at a temp of,30c,40c,50c,60c
64,Most common nerve injury associated with thyroid surgery,Right recurrent laryngeal,Left recurrent laryngeal,Right internal laryngeal,External branch of superior laryngeal nerve
65,Intestinal angiodysplasia involves -,AV malformation,Cavernous hemangioma,Capillary hemangioma,Malignant tumor
66,Patient with chronic hypeension will show following changes on histology of kidney,Hyaline aeriosclerosis,Hyperplastic aeriosclerosis,Onion skin lesions,Vessel lumen dilatation
67,Clotting factor is deficient in hemophilia B?,V,VII,VIII,IX
68,"Sepsis patient with TLC OF 15000, Neutrophil is 40%, Eosinophil 7%, Band cells 15%, Metamyelocytes 5% and Lymphocytes are 35% what is I:T ratio",20%,23%,30%,33%
69,"A 25-year-old woman sustains a deep, open laceration over her right forearm in a motorcycle accident. The wound is cleaned and sutured. Which of the following cell types mediates contraction of the wound to facilitate healing?",Endothelial cells,Fibroblasts,Macrophages,Myofibroblasts
70,TNF and IL1 are produced by -,Neutrophils,Monocytes,Activated Macrophages,Lymphocytes
71,An ovarian neoplasm in a 14-year-old girl is most likely to be,Germ cell tumour,Epithelial tumour,Seoli-Leydig cell tumour,Granulosa cell tumour
72,Nasopalatine cyst arises from,A Embryonic remnants of nasopalatine duct,Cell rest of malassez,Cell rest of serre,Cell remnants of maxillary sinus
73,Preformed antibodies cause -,Hyperacute rejection,Acute rejection,Chronic rejection,Acute humoral rejection
74,Negri bodies are seen in-,Oligodendroglia,Neuron 2012-13,Microglia,Astrocytes
75,Berry aneurysm most commonly occurs due to?,Endothelial injury of vessel due to HTN,Muscle intimal elastic lamina layer defect,Muscle and adventitial layer defect,Adventitia defect
76,Adenosine deaminase deficiency is seen in the following-,Common variable immunodeficiency.,Chronic granulomatous disease,Nezelof syndrome,Severe combined immunodeficiency
77,Which type of cardiomyopathy is seen in alcoholics,Hypertrophic obstructive cardiomyopathy,Dilated Cardiomyopathy,Restrictive Cardiomyopathy,Hypertrophic non obstructive Cardiomyopathy
78,Charcot laden crystals are found in -,Bronchial asthma,Bronchiectasis,Chronic bronchitis,Wegners granulomatosis
79,The use of desmopressin is best indicated for therapy in which of the following bleeding disorders?,Severe hemophilia A,Severe hemophilia B,Von Willebrand disease (VWD),Glanzmann thrombasthenia
80,M.C. site of Ca esophagus is ?,Middle 1/3rd,Upper 1/3rd,Lower 1/3rd,Lower end of esophagus
81,Invasive carcinoma differs from carcinoma in situ by: March 2005,Abnormal nuclear morphology,Pleomorphism,Breached basement membrane,Mitoses
82,Subcutaneous and visceral lipomas are associated with the following type of multiple endocrine neoplasia (MEN) syndrome:,MEN 1,MEN 2 A,MEN 2B,MEN 2C
83,"A 68 year old woman was admitted with a history of weakness for two months. On examination, cervical lymph nodes were found enlarged and spleen was palpable 2 cm below the costal margin. Her hemoglobin was 10.5 g/dl, platelet count 27 x 109/L and total leukocyte count 40 x 109/L, which included 80 % mature lymphoid cells with coarse clumped chromatin. Bone marrow revealed a nodular lymphoid infiltrate. The peripheral blood lymphoid cells were positive for CD19, CD5, CD20 and CD23 and were negative for CD79B and FMC-7. The histopathological examination of the lymph node in this patient will most likely exhibit effacement of lymph node architecture by?",A monomorphic lymphoid proliferation with admixed proliferation centers,"A polymorphous population of lymphocytes, plasma cells, eosinophils and scattered large binucleated cells",A predominantly follicular pattern with variably-sized follicles effacing nodal architecture,A diffuse proliferation of medium to large lymphoid cells with high mitotic rate.
84,Ewings sarcoma arises from -,G cells,Totipotent cells,Neuroectodermal cells,Neurons
85,"A 59-year-old man complains of progressive weakness. He reports that his stools are very dark. Physical examination demonstrates fullness in the right lower quadrant. Laboratory studies show iron deficiency anemia, with a serum hemoglobin level of 7.4 g/dL. Stool specimens are positive for occult blood. Colonoscopy discloses an ulcerating lesion of the cecum. Which of the following serum tumor markers is most likely to be useful for following this patient after surgery?",Alpha-fetoprotein,Carcinoembryonic antigen,Chorionic gonadotropin,Chromogranin
86,HLA Associated with Rheumatoid ahritis is?,HLAB27,HLA-DR4,HLA CW6,HLAB8
87,HMB 45 is an immuno-histological marker for,Melanoma,Schwannoma,Neurofibroma,Rhabdomyosarcoma
88,A developmental abnormality characterized by the presence of fewer than the usual number of teeth is,Anodontia,Oligodontia,Microdontia,Dens in dente
89,"In myocardial infarction, the infarct acquires hyperemic rim with a yellow centre at -",3-7 days,10-20 days,7-14 days,1-2 hours
90,"If you are in PHC, which anticoagulant is used to sent the blood sample for blood glucose estimation?",EDTA,Heparin,Potassium oxalate,Potassium oxalate + sodium fluoride
91,Which is a finding in lymphoid tissues in individuals with common variable hypogammaglobulinemia?,Decreased B cell count,Increased B cell count,Normal B cell count,Absent B cells
92,"""Schaumann bodies"" are seen in?",Sarcoidosis,Chronic bronchitis,Asthma,Syphilis
93,This type of eye problem in children occurs most likely in which infection?,Typhoid,Rubella,HIV,Measles
94,Lymphatic spread is most commonly seen with which type of thyroid cancer -,Medullary,Papillary,Follicular,Lymphoma
95,"A patient who was previously with good muscle mass, now presents with decreased muscle mass. There is history of RTA which led him to be bedridden for 6 months. This decrease in muscle mass is best explained by:",Metaplasia,Dysplasia,Hypertrophy,Atrophy
96,Tuohy's needle is used for,Spinal block,Epidural block,Saddle block,Brachial plexus block
97,Exogenous pyrogen is?,TNF-a,Lipopolysaccharide,Neurotropic factor,IL-6
98,Ulcerative colitis what is seen,Cryptitis,Crypt loss,Crypt branching,Proliferating mucosa
99,A normal couple has one daughter affected with Cystic fibrosis. They are now planning to have another child. What is the chance of siblings being affected by the disease -,0,50%,25%,75%
100,Laugier-Hunziker syndrome is associated with,Idiopathic macular oral hyperpigmentation,Multiple impacted supernumerary teeth,Ankyloglossia,Hemifacial atrophy
101,Premalignant bone lesion ?,Pagets disease,Osteoid osteoma,Osteochondroma,Enchondroma
102,"Onion skin lesions, in the muscular layer of arteriole, are seen in -",SLE,Benign nephrosclerosis,Malignant nephrosclerosis,RPGN
103,Esterase inhibitor deficiency causes:,SLE,MPGN,Hereditary angioneurotic edema,Omen syndrome
104,In renal cell cancer gene involved in mutation,VHL,TP53,NF1,BRCA-1
105,Platelet aggregation is caused by?,Nitrous oxide,Thromboxone A2,Aspirin,PGE2
106,Onion peel appearance of splenic capsle is seen in -,SLE,Scleroderma,RA,Sjogrens
107,Prader villi syndrome is an example of?,Digenic inheritance,Translocation,Genomic imprinting,Trisomy
108,Perivascular lymphocytic and microglial nodules are seen in,Multiple sclerosis,HIV encephalitis,Bacterial meningitis,CMV encephalitis
109,Thymic hypoplasia is:,Wiskott Aldrich syndrome,Henoch Schonlein disease,Digeorge syndrome,Bloom syndrome
110,Most common variant of RCC is,Clear cell,Papillary,Chromophobe,Collecting duct
111,Confirmatory test for the diagnosis ofAmyloidosis is?,Diagnostic peritoneal lavage,Tongue biopsy,Rectal biopsy,Whole body CT scan
112,Normal platelet count is/are seen in -,DIC,Shaken baby syndrome,Microangiopathic hemolytic anemia,Splenomegaly
113,Which of the following is not a histomorphological feature of cirrhosis of liver?,Regenerative nodules,Diffuse microvesicular steatosis,Poal vein thrombosis,Dense bands of fibrosis
114,Sclerosing cholangitis is associated with-,Ulcerative colitis,Celiac sprue,Wilson's disease,Whipple's disease
115,Following is used to stain fungi,PAS,Fontana stain,Ferrous trichrome,Pearls prussian blue
116,Renal papillary necrosis is seen in -a)  Thalassemiab)  DMc)  Phenacetin abused)  Alcoholisme) Cortical necrosis,abc,bcd,ac,bd
117,Mycosis fungoides is? -,T cell lymphoma,B cell lymphoma,Mixed,Plasma cell tumour
118,Telomerase-,RNA polymerase,Causes carcinogenesis,Present in somatic cells,Absent in germ cells
119,Best prognostic type of Hodgkins Disease,Lymphocyte predominant,Lymphocyte depletion,Mixed cellularuty,Nodular sclerosis
120,Which one of the following impairs epithelialization in wound healing?,BGF,PDGF,Fibronectin,TGF
121,"In a 60 year old adult, which of the following diseases cause expansile maxillary lesions?",Paget's disease,Acromegaly,Fibrous Dysplasia,Rickets
122,"A 19-year-old student presents to the university health service with lower abdominal pain and a painful swollen right knee. She denies any trauma to the knee. Pelvic examination is exquisitely painful and reveals an ill-defined thickening in the right and left adnexae. A vaginal discharge is noted. The patient is febrile (38.7degC/103degF). Examination of her right knee reveals an enlarged, tender, and warm joint. The WBC count is 18,500/mL (normal =4,000 to 11,000/mL). If untreated, which of the following would be the most likely complication in this patient?",Bronchopneumonia,Lung abscess,Meningitis,Tubo-ovarian abscess
123,Necrotizing lymphadenitis is seen in:,Kimura disease,Kikuchi Fujimoto disease,Hodgkin disease,Castelman disease
124,Which of the following is the most characteristic ultrastructural feature of paraganglioma on electron microscopy?,Shrunken mitochondria,Large Golgi apparatus,Frequent mitoses,Dense core neuroendocrine granules
125,At what stage neutrophil appear in peripheral blood circulation from bone marrow,Myeloblast,Promyelocte,Myelocte,Band form
126,Post MI day 10 which enzyme is raised -,LDH,CPK,Troponin,Myoglobin
127,Reinke's crystals are found in -,Arrhenoblastoma,Granulosa cell tumor,Dysgerminoma,Hilus cell tumor
128,Pain in inflammation is mediated by,Histamine and nitric oxide,Prostaglandins and interleukins,Interferons and free radicals,Prostaglandins and bradykinins
129,Which of the following inhaled occupational pollutant produces extensive nodular pulmonary fibrosis ?,Silica,Asbestos,Wood dust,Carbon
130,How will you differentiate a mediastinal mass being a thymoma or acute lymphoblastic leukemia?,Cytokeratin,CD1a,CD3,Tdt
131,Hyperophy is -,Increase in cell number,Increase in cell size,Decrease in cell number,Decrease in cell size
132,Pioneer bacteria in dental caries are in,Enamel,Dentin,Pulp,Cernenturn
133,"In gastric outlet obstruction in a peptic ulcer patient, the site of obstruction is most likely to be:-",Antrum,Duodenum,Pylorus,Fundus
134,Atypical lymphocytes in infectious mononucleosis are made up of -,CD4+ T cells,CD8+ T cells,Plasma cells,NK Cells
135,Harlequin ichthyosis is inherited as?,Autosomal dominant,Autosomal Recessive,X Linked dominant,X Linked recessive
136,The antibody seen in drug induced SLE is,Anti histone antibody,Anti nuclear antibody,Anti SM antibody,Anti centromere antibody
137,Type of necrosis in pancreatitis-,Fibrinoid,Coagulative,Fat,Caseous
138,Which of the following mutations in a tumor suppressor agent causes breast carcinoma:-,p 43,p 53,p 73,p 83
139,Which is the most important adhesion molecule for diapedesis?,CD34,CD 31,P-selection,E-selection
140,Klinefelter syndrome karyotype is-,47XXX,45X0,47XXY,46XX\/145X0
141,Highest refractory of index is at,Ant surface of cornea,Post surface of cornea,Center of lens,Posterior capsule of lens
142,Which of the following is x-linked recessive,G-6-PD deficiency,Neurofibromatosis,Thalassemia,Alkaptonuria
143,Following gene when mutated protects tumor cells from apoptosis:,bcl-2,BRCA,RB,TGFβ
144,The most common glomerulonephritis is......,Membranous GN,IgA nephropathy,PSGN,RPGN
145,Which is the most common site for extrathoracic metastases in patients with lung carcinoma -,Kidneys,Liver,Vertebral body,Adrenal glands
146,After an accident a male patient had come for his routine evaluation. His RBCs showed Cabot's ring. What is the likely condition responsible?,Acquired hemolytic anemia,Hemochromatosis,Thalassemia,After splenectomy
147,Most common cause of Heridetary Spherocytosis is:,Spectrin,Glycophyrin,Ankyrin,Band 4
148,A deficiency of which of the following cells can predispose to candidiasis,Eosinophils,Macropages,Plasma cells,T Lymphocytes
149,Cell mediated immune response is which type of hypersensitivity-,I,II,III,IV
150,The classification proposed by the International Lymphoma Study Group for non Hodgkin&;s lymphoma is know as -,Kiel classification,REAL classification,WHO classification,Rappapo classification
151,Longitudinal ulcers in the intestine are seen in: September 2008,Tuberculosis,Typhoid,Amoebiasis,Yersinia
152,Which is autosomal dominant disorder?,Marfan syndrome,Wilson's disease,Ataxia telengiectasia,G-6-PD deficiency
153,Mesangial deposits of monoclonal Kappa/ Lambda light chains is indicative of-,Mesangioproliferative glomerulonephritis,Focal and segmental glomerulosclerosis,Kimmelstiel - wilson disease,Amyloidosis
154,A neonate was noted to have mild growth retardation and facial dysmorphology. The mother was a known abuser of several substances. This infant's problem most likely resulted from maternal intake of which of the following?,Alcohol,Cocaine,Ethylene glycol,Heroin
155,Acute promyelocytic leukaemia (AML-M3) includes which of the following subtypes -,Hyper granular and hypo granular type,Hyper granular and hyper segmented,Hyper granular and micro granular type,Hypo granular and micro granular type
156,Which of the following is not compatible with a diagnosis of juvenile myelomonocytic leukemia?,"Peripheral blood monocytosis, more than 1 x 107L",Increased Hemoglobin F levels for age,Presence of bcr/abl fusion gene,GM - CSF hypersensitivity of myeloid progenitors in vitro
157,"A 30-year-old man has had cramping abdominal pain and bloody diarrhea for the past 4 days. On physical examination, there is diffuse tenderness on palpation of the abdomen. Bowel sounds are present. There are no masses and no organomegaly. A stool culture is positive for Shigella flexneri. The episode resolves spontaneously within 1 week after onset. Six weeks later, he has increasingly severe lower back pain. Physical examination now shows stiffness of the lumbar spine and tenderness of the sacroiliac joints. He is treated with nonsteroidal anti-inflammatory agents. Two months later, the back pain recurs, and he complains of redness of the right eye and blurred vision. Serologic testing for which of the following is most likely to be positive in this patient?",Borrelia burgdorferi,Chlamydia trachomatis,Epstein-Barr virus,HLA-B27
158,Eosinophils are activated by -,IL 1,IL 5,IL 4,IL6
159,Linitis plastica is a type of,Plastic like lining of stomach,Diffuse carcinoma of stomach,Benign ulcer,GIST
160,Which of the following can deliver 90% oxygen?,Venturi mask,Rebreathing O2 mask,Nasal prongs,Non-rebreathing mask with O2reservoir bag
161,Which of the following is (are) Heredofamilial amyloidosis -,Alzheimer's disease,Multiple myeloma,Familial mediterranean fever,RA
162,Most common type of salivary neoplasm -,Adenoid cystic carcinoma,Mixed cell parotid neoplasm,Epidermoid carcinoma,Adenocarcinoma
