question_id,question,opa,opb,opc,opd
163,Which of the following differentiates between condensing osteitis and benign cementoblastoma,Condensing osteitis is associated with vital teeth where as cementoblastoma is associated with non-vital teeth,In condensing osteitis radiopacity is attached to tooth where as in cementoblastoma it is not,CementobLastorna is associated with vital tooth where as condensing osteitis is associated with non-vital tooth,In cementoblastoma radiopacity is attached to tooth where as in condensing osteitis it is not
164,Good prognosis in schizophrenia is indicated by,Soft neurological signs,Affective symptoms,Emotional blunting,Insidious onset
165,Retinoblastoma gene is located on?,Chromosome 6,Chromosome 9,Chromosome 13,Chromosome 2l
166,CA-125 is marker for: September 2007,Breast cancer,Ovarian cancer,Pancreatic cancer,Colon cancer
167,Characteristic renal biopsy immunofluorescence findings that leads to diagnosis of Berger disease is:,Predominantly deposition on IgA in subepithelial region,Predominantly deposition on IgG in subendothelial region,Predominantly deposition on IgG in glomerular basement membrane,Predominantly deposition on IgA in mesangium
168,Gleasons scoring is used for -,Carcinoma testis,Carcinoma colon,Carcinoma thyroid,Carcinoma prostate
169,Howell jolly bodies are seen in?,Iron deficiency anemia,Hemolytic anemia,Polycythemia vera,Multiple myeloma
170,Phagocytosis is the function of-,Astrocytes,Oligodendrocytes,Microglia,Schawan cells
171,"In myasthenia gravis, the antibodies are formed against?",Muscarinic receptor proteins,Acetylcholine receptors,Actin,Myosin
172,Macropolycyte in peripheral smear is a feature of-,Hereditary sherocytosis,Iron deficiency anaemia,Sickle cell anaemia,Megaloblastic anaemia
173,The best example of a proto-oncogene activated by point mutation is -,Ras,N-myc,L-myc,Abl
174,Phagolysosome fusion defect is seen in?,Chronic granulomatous disease,Chediak Hegashi disease,LAM 1,LAM 2
175,"A 15-year-old girl has developed multiple nodules on her skin over the past 10 years. On physical examination, there are 20 scattered, 0.3-cm to 1-cm, firm nodules on the patient's trunk and extremities. There are 12 light brown macules averaging 2 to 5 cm in diameter on the skin of the trunk. Slit-lamp examination shows pigmented nodules in the iris. A sibling and a parent are similarly affected. Genetic analysis shows a loss-of-function mutation. Which of the following inheritance patterns is most likely to be present in this family?",Autosomal dominant,Autosomal recessive,Mitochondrial,Multifactorial
176,Heinz bodies are seen in: September 2006,G-6-PD deficiency,Sickle cell disease,Hereditary spherocytosis,PNH
177,Which of the following is most reliable feature of malignant transformation of pheochromocytoma –,Presence of mitotic figures,Capsular invasion,Vascular invasion,Pleomorphism
178,Swiss cheese pattern of the endometrium is seen in,Carcinoma endometirum,Metropathia hemorrhagica,Hydatiform mole,Halban disease
179,"A 60 year old man admitted with a pathological fracture on examination he was found to be anemic, laboratory examination showed ESR: 100mm/hr, X-ray - multiple lytic lesions. Peripheral smear showed increased rouleaux formation of the red cells and thrombocytopenia. Bone marrow examination confirmed the diagnosis",CML,Vitamin D deficiency,Multiple myeloma,Diffuse large B Cell Lymphoma
180,Which of the following aid in the killing of intracellular bacteria?,Histamine,Interleukin-2,Catalase,Lysozyme
181,Posterior pituitary secrets?,GH,TSH,ADH,FSH
182,Amyloid stroma is seen with?,Papillary carcinoma Thyroid,Medullary carcinoma Thyroid,Follicular carcinoma Thyroid,Anaplastic carcinoma Thyroid
183,Gray hepatization of lungs is seen in day -,1,3-Feb,5-Mar,8-Apr
184,"A patient with microcytic hypochromic anemia, Hb- 9%,serum iron is 20 ?/dl, ferritin level 800 ng/ml, transferrin percentage saturation is 64. What is possible diagnosis?",Atransferrinemia,Iron defeciency anemia,DMT1 mutation,Sideroblastic anaemia
185,Heterozygous sickle cell anemia give protection against -,G6PD,Malaria,Thalassemia,Dengue fever
186,What are gitter cells -,Astrocytes,Macroglia,Modified macrophages in CNS,Oligodendrocytes
187,Fetal and maternal blood can be differentiated by,Kleihaurbetke test,Apt test,Bubbling test,Osmotic fragility test
188,Which of the following is more likely associated with a platelet disorder rather than hemophilia A?,Hemahroses,Epistaxis,Late rebleeding,Prolonged paial thromboplastin time
189,Risk factors for Alzheimer's include:-,Klinefelter syndrome,Noonam syndrome,Down's syndrome,Turner syndrome
190,Caseation necrosis is suggestive of:,Tuberculosis,Sarcoidosis,Leprosy,Midline lethal granuloma
191,Defective chromosome associated with De-George syndrome is?,7,15,17,22
192,Vegetations below the AV valves are present in ?,Libman sach's endocarditis,Chronic rheumatic carditis,Acute rheumatic carditis,Non thrombotic endocarditis
193,A 60 year old male patient complains of weakness and abdominal pain. General physical examination reveals marked splenomegaly and moderate hepatomegaly. Histopathologic findings are suggestive of leukoerythroblastosis. This patient may be suffering from:,Primary myelofibrosis,Intestinal infarction,Sickle cell anemia,Chronic myeloid leukemia
194,Coombs positive hemolytic anemia is associated with,TTP,PAN,SLE,HUS
195,"A 45-year-old man has had progressive dyspnea on exertion with fatigue for the past 2 years. On auscultation of his chest he has a prominent pulmonary component of S2, a systolic murmur of tricuspid insufficiency, and bruits over peripheral lung fields. Jugular venous distension is present to the angle of his jaw when sitting. Laboratory studies show antiphospholipid antibodies. CT angiography shows eccentric occlusions with pulmonary arteries and mosaic attenuation of pulmonary parenchyma. Which of the following is the most likely disease process causing his pulmonary disease?",Atherosclerosis,Pneumonitis,Sarcoidosis,Thromboembolism
196,Mediator of fever is?,IFN-γ,TNF-α,IL-10,IL-2
197,Partial or complete obstruction of some part of the C.V.S by a foreign body transported by the blood stream is termed as:,Thrombosis,Coagulation,Ischaemia,Embolism
198,Whipple's disease is caused by.,Bacteria,Virus,Protozoa,Helminths
199,Which of the following is not a component of the dense granules of platelets?,ADP,Calcium,Epinephrine,Platelet factor 4
200,Which is associated with G2M transition in cell cycle?,Cyclin A,Cyclin B,Cyclin E,Cyclin D
201,&;Lacunar cells&; seen in the following histological type of Hodgkin&;s lymphoma,Nodular sclerosis,Lymphocyte depleted,Lymphocyte dominant,Mixed
202,"A patient presented with fever, night sweats and weight loss. Clinical examination revealed painless lymphadenopathy. Microscopy shows Reed Sternberg cells. Most likely condition is: March 2012",HIV,Chronic lymphocytic leukemia,Hodgkin's lymphoma,Secondary TB
203,Thrush refers to,Acute atrophic candidiasis,Acute pseudomembranous candidiasis,Chronic atrophic candidiasis,Chronic hyperplastic candidiasis
204,Routine Rh typing includes testing?,A antigen,B antigen,C antigen,D antigen
205,The increase in size of individual cells is referred as:,Hypertrophy,Hyperplasia,Hypodontia,Differentiation
206,Stain not used for lipids?,Oil red O,Congo red,Sudan III,Sudan black
207,Ca 125 is used for ?-,Follow up of ovarian cancer,Diagnosis of pancreatic cancer,Diagnosis of stomach cancer,Diagnosis of ovarian cancer
208,"A 70 Year old male complains of ulceration on Lower lip since 1 moth with Lymph node involvement. Patient has history of tobacco chewing since 30 years 6-7 times per day, patient also complains of loss of weight since 2 months and change in voice since one month

A reliable clinical condition to consider for the diagnosis as malignancy is",An ulcerative lesion,An ulcerative and painful lesion,Ulceration and fixation of the lymph node,Bilateral involvement of lymph node
209,Chromophobe variant of Renal cell carcinoma is associated with:,VHL gene mutations,"Trisomy of 7 and 17 (+7, +17)",3 p deletions (3p-),"Monosomy of 1 and Y (-1, -Y)"
210,Flow cytometry is done to know -,Rapid cell shrinkage,Blood flow to brain,Net O2 supply to tissues,Amount of O2 bound to hemoglobin
211,Earliest change in cell death is?,Karyolysis,Loss of plasma membrane,Cell swelling,Karyorrhexis
212,Goodpasteurs syndrome is,Renal failure with lung hemorrhage,Renal failure with brain hemorrhage,Renal hemorrhage,Renal failure
213,Which of the following is the cause of break of glomerular basement membrane sometimes and sub epithelial deposits in electron microscopy?,Membranous glomerulonephritis (MGN),Focal glomerular sclerosis,Rapidly progressive glomerulonephritis (RPGN),Minimal change (MCD)
214,Mesangial deposition of electron dense substance seen in?,IgA nephropathy,Membranous nephropathy,Minimal change disease,Post streptococcal glomerulonephritis
215,Which of the following markers is specific for gastro intestinal stromal /tumors (GIST)?,CD 117,CD34,CD23,S-100
216,Which of the following is not expressed in majority of cases of pediatric B-cell acute lymphoblastic leukemia?,Terminal deoxynucleotidyl transferase (TdT),CD19,CD10,CD7
217,The anti-inflammatory mediator is?,Interleukin 4,Interleukin 1,Interleukin 6,TNF- Alpha
218,Extramammary Paget's disease is seen in:-,Ovary,Uterus,Vagina,Vulva
219,Schaumann bodies are seen in -,Sarcoidosis,Chronic bronchitis,Asthma,Syphilis
220,When is peak bone mass achieved among the following?,Infancy,Early adolescence,Early adulthood,Early foies
221,A single whole-body dose of how many rads could result in death -,100 rads,200 rads,300 rads,500 rads
222,The characteristic lesion of atherosclerosis is,Fibrinoid necrosis of the media,Giant cell reaction in the retina and internal elastic lamina,Organised thrombus in the affected segment,'Fibro-fatty' lesion in the intima of the blood vessels
223,Common primary sites of metastasis to the brain are-,Thyroid Ca,Tongue Ca,Lung Ca,Breast Ca
224,Cathelicidins are rich in which of the following amino acid?,Cysteine,Cystine,Methionine,Arginine
225,Hemolytic disease of newborn is an example of -,Type III hypersensitivity,Type Il hypersensitivity,Ahus reaction,Type IV hypersensitivity
226,Best prognostic type of Hodgkin's lymphoma is ?,Lymphocytic predominant,Lymphocytic depletion,Mixed cellularity,Nodular sclerosis
227,In which of the following are linear IgA deposits in mesangium noted?,Henoch Schoenlein Purpura,Malaria,Good Pasture's Syndrome,Wegener's Granulomatosis
228,Which of the following functions is associated with the oncogenic L 'MYC' in lung cancer -,Protein kinase,GTP binding protein,Nuclear binding protein,Growth factor
229,A 23-year-old African-American man with a history since early childhood of severe anemia requiring many transfusions has non healing leg ulcers and recurrent periods of abdominal and chest pain. These signs and symptoms are most likely to be associated with which of the following laboratory abnormalities?,Decreased erythropoietin,Increased erythrocyte osmotic fragility,Decreased erythropoiesis,Sickle cells on peripheral blood smear
230,Which of the following is a free radical scavenging enzyme?,Myeloperoxidase,Glutathione peroxidase,NADPH oxidase,Protease
231,Which of the following is the best parameter for assessment of body iron stores?,Serum iron,Serum TIBC,Serum ferritin,Serum transferrin
232,An Example of a tumour suppressor gene is:,myc,fos,ras,RB
233,Loss of foot processes seen on electron microscopy of renal biopsy is a classical feature in which of the following?,Membranous nephropathy,Minimal change disease,lgA nephropathy,Rapidly progressive gloerulonephritis
234,"What does ""cardiac polyp"" mean?",Acute infarct,Cardiac aneurysm,Benign tumor,Fibrinous clot
235,Most commonly affected organ in the disorder characterized by the peripheral blood smear is:,Lungs,Kidney,Spleen,Liver
236,Programmed cell death is seen in?,Cytolysis,Apoptosis,Necrosis,Proptosis
237,Which of the following is not stored at cold temperature?,Whole blood,Packed RBCs,Leucoreduced RBCs,Platelet concentrate
238,The highest life time risk of pancreatic malignancy is seen with:,Peutz-Jeghers syndrome,Hereditary nonpolyposis colorectal cancer,Li-Fraumeni syndrome,Familial adenomatous polyposis
239,Which of the following is a nutritional deficiency anemia?,Aplastic anemia,Sickle cell anemia,Megaloblastic anemia,Hemolytic anemia
240,"In cyclooxygenase (COX) pathway of the arachidonic acid (AA') metabolism, which of the following products helps to promote the platelet aggregation and vasoconstriction?",C5a,Thromboxane A2,Leukotriene B4,C1 activators
241,A linear pattern of immunoglobulin deposition along the glomerular basement membrane that can be demonstrated by immunofluorescence is typical of,Lupus nephritiS,Diabetic glomerulopathy,Goodpasture's syndrome,Renal vein thrombosis
242,A stellate granuloma is seen in?,Crohn's disease,Hodgkin's disease,Cat scratch disease,Berrylliosis
243,In Marfan&;s syndrome which of the following is affected,Collagen,Fibrillin,Actin,Fibronectin
244,"In which of the following conditions, Aniridia and Hemihypertrophy are most likely present -",Neuroblastoma,Wilm's tumour,Non-Hodgkin's lymphoma,Germ cell tumour
245,Effective polymerase reaction was repeated for 3 cycleson a DNA molecule. What will be the resultingformation of the copies?,Double number of copies,Three times the number of DNA molecule,Four times the number of DNA molecule,8 times
246,Glomerulosclerosis is a feature of -,Diabetes mellitus,Hypertension,Acute glomerulo nephritis,Nephrotic syndrome
247,"By definition, granulomas are composed of:",Cholesterol clefts,Collagen,Endothelial cells and fibroblasts,Epithelioid cells
248,A 2 year old child presents with scattered lytic lesions in the skull. Biopsy revealed Langerhans giant cells. The most commonly associated marker with this condition will be -,CD 1a,CD57,CD3,CD68
249,In pregnancy which viral infection has maximum moality?,Hepatitis A virus,Hepatitis B virus,Hepatitis C virus,Hepatitis E virus
250,Sago spleen is seen in,Infarction,Amyloidosis,Chronic venous congestion,Tuberculosis
251,Most common location of the chronic gastric ulcer is:-,Greater curvature,Lesser curvature near proximal stomach,Lesser curvature near incisura,Pylorus
252,Characteristic feature of Rheumatic carditis is ?,Pericarditis,Endocarditis,Myocarditis,Pancarditis
253,The commonest primary neoplasm of the heart in adults is?,Lipoma,Myxoma,Papillary fibroelastoma,Rhabdomyoma
254,Large kidney is seen in A/E -,Benign nephrosclerosis,Lymphoma,Amyloidosis,DM
255,Chronic periostitis in children is known as,Cherubisrn,Garre's osteomyelitis,Histiocytosis X,Tuberculous osteomyelitis
256,Cytokines-,Includes interleukins,Produce only in sepsis,Are polypeptide (complex protein),Highly specific action
257,Auto antibody in Sjogrens syndrome is?,Anti centromere antibody,Anti Ro & anti La,Anti ds DNA,Anti RNP
258,. Pseudopolyposis is seen in,Crohn's disease,Ulcerative colitis,Juvenile polyposis,Enteric fever
259,Pearl's stain used to demonstrate the following in tissues -,Hemosiderin,Fat,Reticulin,Fibrin
260,Which of the following vascular lesions can be seen commonly in Turner syndrome ?,Nevus flammeus,Cavernous lymphangioma,Pyogenic granuloma,Capillary hemangioma
261,The gene that regulates normal morphogenesis during development is :,FMR-1 gene,Homeobox gene.,P-16,FTEN.
262,Most common salivary gland tumor a -,Mucoepidermoid carcinoma,Pleomorphic adenoma,Wahims tumor,Oncocytoma
263,The earliest hematologic manifestation of megaloblastic anemia is,Increase in MCV,Hypersegmented polymorphs,Thrombocytopenia,Leukopenia
264,Hemochromatosis is a defect in metabolism of ?,Iron,Copper,Magnesium,Calcium
265,Comment on the histopathological specimen,Teratoma,Rhabdomyoma,Rhabdomyosarcoma,Neuroblastoma
266,"A 9-year-old girl develops widespread pinpoint skin hemorrhages. She recovered from a flu-like illness 1 week earlier. Laboratory findings reveal a platelet count of 20,000/mL but no other abnormalities. Her bone marrow shows an increased number of megakaryocytes. The platelet count is normal after 2 months. Which of the following is the appropriate diagnosis?",Antiphospholipid antibody syndrome,Disseminated intravascular coagulation,Hemolytic-uremic syndrome,Idiopathic thrombocytopenic purpura
267,Neuroendocrine lesions of the lung are -,Carcinoid tumor,Alveolar carcinoma,Hamartoma,Asthma
268,A common type of Ca in middle 3rd of the esophagus-,Adeno Carcinoma,Squamous Carcinoma,Adeno squamous Carcinoma,Leiomyosarcoma
269,"A patient presents with Ahritis, hyperpigmentation of skin and hypogonadism, likely diagnosis is.",Hemochromatosis,Ectopic ACTH secreting tumour of the lung,Wilson's disease,Rheumatoid ahritis
270,Immune complex mediated hypersensitivity is classified as: (Repeat),Type 1 H ypersensitivity reaction,Type 2 Hypersensitivity reaction,Type 3 Hypersensitivity reaction,Type 4 Hypersensitivity reaction
271,Which is not a pro-inflamatory cytokine ?,IL-8,IL-11,IL-1,PAF
272,Normal transferrin is saturated with iron ?,20%,35%,50%,70%
273,Chromosome defective in cystic fibrosis is-,Chromosome 5,Chromosome X,Chromosome 7,Chromosome 1
274,Type of inheritance in Wilson's disease?,Autosomal dominant,Autosomal recessive,X-linked dominant,X-linked recessive
275,Arnold head is a feature of:,Fibrous dysplasia.,Paget's disease.,Cleidocranial dysplasia.,Cherubim.
276,Which of the following is a manifestation of 22q11 mutation syndrome?,Hypercalcemia,Conotruncal abnormalities,Thymic hyperplasia,Dysmorphogenesis of the 1st and 2nd pharyngeal pouches
277,Schistocytes are seen in?,H.U.S,H.S.P,Abetalipoproteinemia,Myelofibrosis
278,Uremia occurs when total GFR is reduced by,60%,25%,50%,80%
279,In Non-Hodgkin's lymphoma early involvement of bone marrow is typical of which variety ?,Diffuse,Nodular,Lymphocytic well differentiated,Lymphocytic poorly differentiated
280,Hypocalcemia is seen with which of the following: September 2008,Thyrotoxicosis,Hyperparathyroidism,Acute pancreatitis,Addison disease
281,"A peripheral smear with increased neutrophils, basophils, eosinophils, and platelets is highly suggestive of:",Acute myeloid leukemia,Acute lymphoblastic leukemia,Chronic myelogenous leukemia,Myelodysplastic syndrome
282,Eosin-5- Maleimide flow cytometry is used for diagnosis of:-,G6PD,Hereditary spherocytosis,Sickle cell anemia,Alpha thalassemia
283,The inheritance pattern of Familial hypercholesterolemia is,Autosomal recessive,Autosomal dominant,X-linked dominant,X-linked recessive
284,BRAF gene mutation is seen in,Breast carcinoma,Melanoma,Osteosarcoma,Prostate carcinoma
285,Most common tumour of hea is -,Myxoma,Rhabdomyosarcoma,Fibroma,Leiomyosarcoma
286,Most common karyotype abnormality associated with turner syndrome is,"45,X","46,XY","47,XXY","45,Y"
287,The most specific immunohistochemical marker to rule out invasive ductal carcinoma would be?,Ki-67,p 63,Desmin,HER 2 / neu
288,Ground glass hepatocytes are seen in which of the Viral hepatitis,HAV,HBV,HCV,HDV
289,"""Wire loop lesion"" in kidney are pathognomonic of which of the following conditions?",Amyloidosis,Systemic lupus erythematosis,Good pasture syndrome,Diabetic nephropathy
290,Vasoconstricting mediator is -,Prostacyclin,Thromboxane-A2,PGD2,Lipoxins
291,Most characteristic finding in diabetic nephropathy is,Diffuse glomerusclerosis,Nodular glomerulosclerosis,Diffuse coical sclerosis,Renal atherosclerosis
292,What does MHC class III genes encode?,Interleukin 2,Beta 2 microglobulin,Tumor necrosis factor,Complement component C3
293,Hydroxyl ions are destroyed in the body by?,Vitamin C,Vitamin A,Vitamin K,Vitamin D
294,Which of the following is found in secondary granules of neutrophils?,Catalase,Gangliosidase,Proteolytic enzyme,Lactoferrin
295,Memory cells are best provided by?,Helper cells,Cytotoxic cells,Macrophages,NK cells
296,Which renal pathology has highest risk of recurrence following renal transplantation,Goodpasture's syndrome,MPGN,Alport's syndrome,Amyloidosis
297,Which of the following white blood cells act as scavengers when they engulf and digest pathogens?,Macrophages,T cells,B cells,Lymphocytes
298,Apoptotic bodies are:,Clumped chromatin bodies,Pyknotic nucleus without organelles,Cell membrane-bound with organelles,Mitochondrial fragments
299,"In anoxia of liver, necrosis is seen in -a) Centrilobularb) Around the peripheryc) Around the central veind) Around the bile duct",ac,bc,ad,b
300,Intracorpuscular hemolytic anemia is seen in ?,Autoimmune hemolytic anemia,TTP,Thalassemia,Infection
301,Whipple's is disease is caused by:-,Bacteroides,Acinetobacter,H.pyori,Tropheryma whippelii
302,Michaelis-Gutmann bodies are seen in:,Xanthogranulomatous pyelonephritis,Mail patella syndrome,Malakoplakia,Renal osteodystrophy
303,A five-year-old child presents with chronic bed wetting and bilateral loose deciduous first molars. His mother  says that she want to drink of water several times during each night. Which of the following is the most likely diagnosis?,Hand-Schuller-Christian disease,Marble bone disease,Nieman-Pick disease,Polyostotic fibrous dysplasia
304,A 25yr old male with thyroid swelling Biopsy shows intense lymphocytic infiltration along with huhle cell change TSH increased,Hashimoto's thyroiditis,Grave's disease,follicular carcinoma,Medullary carcinoma thyroid
305,Central to apoptosis is the utilization of -,Nitrous oxide,Adenyl cyclase,Caspases,c-AMP
306,Anemia with reticulocytosis is seen in -,Hemolysis,Iron deficiency anemia,Vitamin B12 deficiency,Aplastic anemia
307,"In Lobar pneumonia, the presence of fibrinosuppurative exudates with disintegration of red cells is seen in the stage of -",Congestion,Red hepatization,Grey hepatization,Resolution
308,Transition from G2 to M phase of the cell cycle is controlled by:,Retinoblastoma gene product,p53 protein,Cyclin E,Cyclin B
309,CD marker for cytotoxic T-cells?,CD 4,CD 8,CD 21,CD 45
310,Leptocyte in blood smears seen in?,Sickle cell anemia,Thalassemia,Post splenectomy,Uremia
311,"The clinical combination of dermatitis, diarrhoea, and dementia resulting from a deficiency of niacin is referred to as:",Beriberi,Marasmus,Pellagra,Rickets
312,"Negri bodies are characteristic of:September 2008, March 2013",Tetanus,Rabies,Polio,AIDS
313,A 5-year-old girl presents with the sudden onset of diffuse arthralgias and skin rash. Physical examination shows a violaceous maculopapular rash on the lower torso. Urinalysis discloses oliguria and 2+ hematuria. Urine cultures are negative. This child's clinical presentation is commonly associated with which of the following diseases?,Berger disease,Goodpasture syndrome,Hemolytic uremic syndrome,Henoch-Schonlein purpura
314,Teiary hyperparathyroidism is-,High PO4 level with metastasis,Secondary hyperparathyroidism with CRF,"Primary hyperparathyroidism with low Ca"" levels",Secondary hyperparathyroidism with chief cell adenoma
315,A 12-year-old girl presents for a routine physical examination. The patient has numerous freckles over her upper trunk and face. Which of the following terms best describes the morphologic appearance of her freckles?,Comedo,Macule,Nodule,Papule
316,"A 45-year-old man who is a heavy smoker complains of sudden onset of high fever and chills, nonproductive cough, and chest pain. An X-ray film of the chest shows bilateral, diffuse, patchy infiltrates. The patient reports that a number of similar cases have occurred recently in the building where he works. He responds to antibiotics and recovers. Which of the following is the most likely a reservoir for the microorganism that is responsible for this patient's respiratory tract infection?",Cooling towers,Elevator shafts,Floor cleaners,Heat pumps
317,Multifactorial inheritance is most likely to play a role in?,Cleft lip,Marfan's syndrom,Erythroblastis fetalis,Down's syndrome
318,"In apoptosis, the nucleus is destroyed by",Endonuclease fragmentation,Karyolysis,Phagocytosis,Necrosis
319,Which of the following is a characteristic feature of chronic myeloid leukemia (CML)?,Auer rods,Basophilia,Increased LAP score,Bone marrow fibrosis
320,Bullous disease in which autoantibodies are formed against antigens of epidermal intercellular junctions,Pemphigus Vulgaris,Epidermolysis bullosa,Dermatitis herpatitis,Bullous pemphigoid
321,Homer wright rossette are seen in-a)  Neuroblastomab)  Astrocytomac)  Meningiomad)  Pinealoma,ad,c,ac,ab
322,"A 45-year-old man presents with chest pain, fever, productive cough, and rust-colored sputum. The patient was diagnosed with tuberculosis in his early 20s. A chest X-ray shows multiple, nodular infiltrates and cavitary lesions. A lung biopsy reveals necrotizing inflammation and vascular thrombi with branching fungal hyphae. Which of the following is the most likely diagnosis?",Actinomycosis,Aspergillosis,Candidiasis,Cryptococcosis
323,Sloughing of necrotic epithelium is characteristic of:,Aspirin burn,Denture sore mouth,Traumatic ulcer,Contact dermatitis
324,Which is the best marker of SLE ?,Anti Sm antibodies,Anti dsDNA antibodies,Anti histone antibodies,Anti Ro Antibodies
325,Pautriers abscess is mainly composed of which of the following cells,Eosinophils,Lymphocytes,Neutrophils,Macrophages
326,Most common tumor in lateral hemisphere of brain,Astrocytoma,Meningioma,Ependymoma,Medulloblastoma
327,"A 15 year old boy presented with one day history of bleedig gums, subconjunctival bleed and purpuric rash. Investigations revealed the following results: Hb-6.4 gm/dL; TLC-26,500/mm3, platelet-35,000 mm3. Prothrombin time-20 sec with a control of 13 sec, paial thromboplastin time-50 sec and fibrinogen l0mg/dL. Peripheral smear was suggestive of acute myeloblasts leukemia. Which of the following is most likely?",Myeloblasts leukemia without maturation,Myeloblasts leukemia with maturation,Promyelocytic leukemia,Myelomonocytic leukemia
