question_id,question,opa,opb,opc,opd
328,Glanzmann disease is characterised by which of the following?,Congenital defect of RBCs,Defect of neutrophils,Congenital defect of platelets,Clotting factor deficiency
329,Gluten free diet is use in,Celiac disease,Tropical sprue,Ulcerative colitis,Irritable bowel syndrome
330,"58-year-old man suffered road traffic accident and came to the hospital. He had multiple fractures in his lower limbs, ribs and lung contusion. Ultimately he succumbed to his injuries. At autopsy, a biopsy from the lung showed the following appearance. What is the likely cause of his death?",Fat embolism,Emphysema,Pulmonary embolism,Congestive hea failure
331,Lifespan of transfused platelets is,<24 hours,1-3 days,3-5 days,7-14 days
332,Malignancy with familial inheritence -a)  Ca breastb)  Ca ovaryc)  Ca testisd)  Ca panreas,ab,a,ad,bc
333,Cystic medial necrosis responsible for aortic dilatation and rupture is seen in,Syphilitic aneurysm,Takayasu arteritis,Atherosclerosis,Marfan syndrome
334,Vanillyl mandelicacid (VMA) increased in,Parathyroidism,Pheochromocytoma,MEN-1,Addison's disease
335,Metastatic calcification is most often seen in,Lymphnodes,Lungs,Spleen,Liver
336,"Kinky hair desease is disorder where an affected child has peculiar white stubby hair, does not grow, brain degeneration is seen and dies by age of two years. Mrs A is hesitant about having children because her two sisters had sons who had died form kinky hair disease. Her mother's brother also died of the same condition. Which of the following is the possible mode of inheritence in her family -",X-linked recessive,X-linked dominant,Autosomal recessive,Autosomal dominant
337,"Which of the following nutritional factors is required for proper collagen assembly in the scar tissue of the 25-year-old woman who sustains a deep, open laceration over her right forearm in a motorcycle accident.",Folic acid,Thiamine,Vitamin A,Vitamin C
338,"A baby is born with a flat facial profile, prominent epicanthal folds, and simian crease. She vomits when fed, and upper GI studies demonstrate gas in the stomach and duodenal bulb. Which of the following cardiovascular abnormalities might this child also have?",Atrial septal defect,Berry aneurysm,Coarctation of the aoa,Endocardial cushion defect
339,"A 34 year old patient presented with thyroid nodule. Ultrasonography of the thyroid nodule shows foci of calcification. Histological features are shown in the diagram below, what is your likely diagnosis?",Follicular carcinoma,Medullary carcinoma,Papillary carcinoma,Anaplastic carcinoma
340,Which of the following tumours have an increased elevation of placental alkaline phosphatase in the serum as well as a positive immunohistochemical staining for placental alkaline phosphatase ?,Seminoma,Hepatoblastoma,Hepatocellular carcinoma,Peripheral neuroectodermal tumour
341,Chromosome involved in Myotonic Dystrophy is,Chromosome 19,Chromosome 20,Chromosome 21,Chromosome 22
342,"A 3-year-old patient has extensive vesicles on lip,tongue, oral mucous membrane. After 2-4 days vesicles rupture at followed by pseudomembrane formation and also some dermal lesions seen what will be the diagnosis",Herpetic stomatitis,EM,ANUG,Steven-Johnson syndrome
343,Tissue of origin of Kaposi sarcoma is:,Lymphoid,Vascular,Neural,Muscular
344,A 30-year-old male patient presented with dyspnea ECHO showed mitral stenosis with left atrial hypertrophy. Excised mitral valve is as shown. What is the diagnosis?,Tuberculosis,Sarcoidosis,Rheumatic heart diseases,Fungal granuloma
345,Which of the following conditions are associated with pauci-immune crescentic glomerulonephritis-,Henoch-schonlein nephritis,Lupus nephritis,Microscopic polyangitis,Alpo's syndrome
346,Which type of FSGS has worst prognosis?,Tip variant,Collapsing,NOS,Perihilar
347,Most common fixative used in electron microscopy:,Glutaraldehyde,Formalin,Picric acid,Absolute alcohol
348,Which of the following is not a myeloproliferative neoplasm?,Polycythemia vera,Juvenile myelomonocytic leukemia,Chronic myeloid leukemia,Essential thrombocythemia
349,"A 4-month old infant is brought to the physician for a routine examination. Physical examination shows epicanthic folds and a palmar simian crease. Cytogenetic testing shows an autosomal trisomy. 
Which of the following cardiac anomalies is most commonly associated with this condition?",Atrial septal defect,Complete Atrioventricularseptal defect,Mitral stenosis,Patent ductusarteriosus
350,The most common malignant tesicular neoplasm is,Teratoma,Seminoma,Choricocarcinoma,Lymphoma
351,Which blood group is universal donor?,A,B,O,AB
352,The histopathology of osteopetrosis shows:,EndosteaL bone formation and lack of normal bone resorption,Periosteal bone formation and lack of normal bone resorption,Presence of extra collagen fibres and Less calcification resulting in resistance of bones to fracture,Presence of numerous osteoclasts and a few osteoclasts
353,Which of the following pigments accumulates in liver in Dubin-Johnson syndrome?,Monoglucuronate bilirubin,Epinephrine metabolite,Bilirubin pigment,Melanotic pigment
354,Reed sternberg cells are found in-,Hodkin's disease,Sickle cell anaemia,Thalassemia,CML
355,A patient on warfarin sodium following myocardial infarction reports for an oral surgical procedure. Which one of the following Laboratory tests should be preferred to ascertain the fitness,Prothrornbin time,Tourniquet time,Clotting time,Bleeding time
356,Juvenile papillomatosis is caused by:,HPV,"B, EBV",CMV,Herpes virus
357,"An 8-year-old boy presents with headaches, dizziness, and malaise approximately 2 weeks after a severe sore throat. His mother describes puffiness of his face and darkening of his urine. She also notes that her son is passing less urine and that he is becoming increasingly short of breath. On physical examination, there is anasarca, hypertension (190/130 mm Hg), and tachycardia. The urine is scanty and brownish red. Urinalysis shows 3+ proteinuria. Microscopic examination of the urine discloses numerous RBCs, as well as occasional granular and red cell casts. A renal biopsy is stained by direct immunofluorescence microscopy for complement C3, and the results are shown. Which of the following is the most likely cause of acute postinfectious glomerulonephritis in the patient?",Escherichia coli,Epstein-Barr virus,Group A (b-hemolytic) streptococci,Klebsiella sp.
358,Which of the following is the classification proposed by the International Lymphoma Study Group for non-Hodgkin's lymphoma?,Kiel classification,REAL classification,WHO classification,Rappapo classification
359,Facial nerve paralysis is common with,Pleomorphic adenoma,Epidermoid carcinoma,Warthin's tumour,Lymphoepithelial carcinoma
360,Bile infarct is related to -,Hepatitis B,Dubin Johnson syndrome,Extrahepatic cholestasis,Intraphepatic cholestasis
361,Which of the following is not a pa of extracellular matrix?,Laminin,Fibronectin,Vimentin,Collagen
362,"In a specimen of kidney, fibrinoid necrosis is seen and onion peel appearance is also present. Most probable pathology is:",Hyaline degeneration,Hyperplastic aeriosclerosis,Glomerulosclerosis,Fibrillary glomerulonephritis
363,"A 3-year-old child is evaluated by a pediatrician for poor growth despite excessive food intake. The mother repos that the child's stools are bulky, foul-smelling, and difficult to flush because they float. Determination of which of the following would most likely be diagnostic in this case?",Na+ in cerebrospinal fluid,Na+ in serum,Na+ in sweat,Na+ in urine
364,Vasoconstrictor anong these ?,NO,PGI2,Angiotensin-II,ANP
365,A 2-year-old boy is brought in by his mother because of the bloody stool after ingestion of unknown amount of rat poison (coumarin based). He is admitted and treated with fresh frozen plasma and vitamin K after his prothrombin time (PT) was found to be prolonged. What is the reason for bloody stool in this case?,Local irritation of bowels because of the ingestion of rodenticide,Coumarin is antagonizing vitamin K reductase necessary for production of factors VIII and IX,"Coumarin is antagonizing vitamin K reductase necessary for production of factors II, VII, IX & X",Coumarin caused disseminated intravascular coagulation (DIC)
366,"A 40-year-old man complains of a 2-week history of increasing abdominal pain and yellow discoloration of his sclera. Physical examination reveals right upper quadrant pain. Laboratory studies show elevated serum levels of alkaline phosphatase (520 U/dL) and bilirubin (3.0 mg/dL). A liver biopsy shows portal fibrosis, with scattered foreign bodies consistent with schistosome eggs. Which of the following inflammatory cells is most likely to predominate in the portal tracts in the liver of this patient?",Basophils,Eosinophils,Macrophages,Monocytes
367,AntiLKM antibody is seen in ?,Hepatitis A,Hepatitis C,Hepatitis D,Autoimmune hepatitis type II
368,"In familial mediterranean fever, the gene encoding the following protein undergoes mutation-",Pyrin,Perforin,Atrial natriuretic factor,Immunoglobulin light chain
369,Brown tumor of bone is seen in -,Hyperparathyroidism,Hypoparathyroidism,Hypo-thyroidism,Hyperthyroidism
370,A 9-year-old girl has had a sore throat for the past 2 days. On physical examination there is pharyngeal erythema with yellowish exudates over swollen palatine tonsils. A Gram stain of the exudate shows gram-positive cocci in chains. She is given penicillin therapy. What is the most likely complication prevented by prompt treatment of this girl?,Carditis,Hepatitis,Meningitis,Otitis
371,"Bifid ribs, multiple radiolucent lesions of the jaws, multiple basal cell nevi and falx cerebri calcification are found in",Basal cell nevus syndrome,Sturge weber syndrome,Horner syndrome,Hereditary internal polyposis
372,Familial Renal Cell carcinoma is associated with:,Turners syndrome,Alpos syndrome,Peutz-jeghers syndrome,Von Hippel Lindau syndrome
373,"A 56-year-old diabetic woman has recently been treated with a 2-week course of antibiotics for a skin infection. She returns to the clinic for follow-up with a new complaint of a ""cottage cheese-like"" vaginal discharge with significant vaginal itching. The most likely cause of these symptoms is",C. granulomatis.,C. albicans.,Chancroid.,Neisseria meningitidis.
374,Antitopoismerase I is mark of-,Systemic sclerosis,Classic Polyaeritis nodosa,Nephrotic syndrome,Rheumatoid ahritis
375,A 58-year-old man with a long-standing history of type 2 diabetes mellitus suffers a massive hemorrhagic stroke and expires. Examination of the pancreas shows hyalinization of many islets of Langerhans. Which of the following characterizes the material within the islets of Langerhans?,Amyloid,Collagen type IV,Fibrin,Fibronectin
376,"A 44-year-old woman has had increasing abdominal distention for the past 6 weeks. On physical examination, there is an abdominal fluid wave, and bowel sounds are present. Paracentesis yields 1000 mL of slightly cloudy serous fluid. Cytologic examination of the fluid shows malignant cells consistent with adenocarcinoma. Molecular analysis of these cells shows an MSH2 gene mutation with microsatellite instability. Her medical history indicates that she has had no major medical illnesses and no surgical procedures. Her sister was diagnosed with endometrial cancer and her brother had carcinoma of the stomach. Which of the following conditions is the most likely cause of this patient's symptoms?",Angiodysplasia,Crohn disease,Diverticulosis,Lynch syndrome
377,One of the following disorders is due to maternal disomy of chromosome 15-,Prader Willi syndrome,Angelman syndrome,Hydatidiform mole,Klinefelter's syndrome
378,Red or brown discoloration of teeth is seen in,Porphyra,Internal resorption,Nasmynth membrane,Silver
379,'Hairy cell leukemia' is a neoplastic proliferation of-,T.cells,B.cells,Myeloid cells,Macrophages
380,Hemophilia is associated with which chromosome ?,X,Y,13,8
381,"A 42-year-old man has had a constant bad taste in his mouth for the past month. On physical examination there are white fluffy patches on the sides of his tongue. These cannot be scraped off. A biopsy is taken and on microscopic examination shows squamous epithelial hyperkeratosis, parakeratosis, and koilocytosis. Immunohistochemical staining for Epstein- Barr virus (EBV) is positive. Which of the following is the most likely risk factor for his oral lesions?",Chronic alcohol abuse,Diabetes mellitus,HIV infection,Pernicious anemia
382,Liquefaction necrosis is commonly seen in,Brain,Lung,Liver,Spleen
383,Onion peel appearance of splenic capsle is seen in-,SLE,Scleroderma,RA,Sjogrens
384,Trauma to breast causes which type of necrosis ?,Coagualtive necrosis,Liquefactive necrosis,Caseous necrosis,Fat necrosis
385,Which of the following salivary gland tumors has highest rate of malignant transformation?,Parotid,Submanidbular,Sublingual,Minor
386,Which of the following is associated with H.pylori:March 2009,Ulcerative colitis,Crohn disease,Celiac sprue,MALToma
387,"A 29-year-old woman complains of nervousness and muscle weakness of 6 months in duration. She is intolerant of heat and sweats excessively. She has lost 9 kg (20 lb pounds) over past 6 months, despite increased caloric intake. She frequently finds her hea racing and can feel it pounding in her chest. She also states that she has missed several menstrual periods over past few months. Physical examination reveals warm and moist skin and bulging eyes (exophthalmos). Laboratory studies will likely reveal which of the following endocrine abnormalities in this patient?",Anti-thyroid DNA antibodies,Anti-TSH receptor antibodies,Decreased uptake of radioactive iodine in the thyroid,Increased serum TSH
388,'Canker sore' is otherwise commonly known as,Recurrent apthous ulcer,Recurrent herpetic gingivitis,Acute necrotizing ulcerative gingivitis,Recurrent herpes labialis
389,Struma ovarii is,Teratoma of ovary,Thyroid gland tumor in pregnancy,May present as hypothyroidism,Ovarian stromal hyperplasia
390,Which thyroid carcinoma has amyloid deposition-,Anaplastic,Follicular,Medullary,Papillary
391,NK cells express-,"CD 15, CD 55","CD16, CD56","CD 16,CD 57",CD21 CD 66
392,Mantle cell lymphoma shows-,"CD5 +, CD25","CD 5 +, CD 10 +","CD 5+, CD23+","CD 5+, CD 23 -"
393,The main feature of chemotaxis is:,Increased random movement of neutrophils,Increase adhesiveness to intima,Increased phagocytosis,Unidirectional locomotion of the neutrophils
394,Which is the most common cytogenetic abnormality in myelodysplastic syndrome (MDS)?,Trisomy 8,20q-,5q-,Monosmy 7
395,The critical narrowing of coronary vessels to cause angina is -,More than 50%,More than 60%,More than 70%,More than 80%
396,Premalignant lesion of oral cavity includes,Lichen planus,Erythroplakia,Bowen disease,Behchet disease
397,Medullary thyroid carcinoma occurs due to the mutation of: (Repeat),RET oncogene,P53 gene,"RAS H-RAS, K-RAS, N-RAS",BRCA-I
398,Desmoplasia is defined as: March 2013,Increase in number of neoplastic cells,Benign tumours arising in fibrous tissue,Abundant collagenous stroma in tumour,Benign cailaginous tumours
399,Rootless teeth refer to,Dentin dysplasia,Amelogenesis imperfecta,Dentinogenesis imperfecta,Regional odontodysplasia
400,Hemophilia A is caused due to deficiency of,Factor X,Factor XI,Factor IX,Factor VIII
401,Radiation exposure during infancy has been linked to,Breast,Melanoma,Thyroid,Lung
402,Spleniculi means,Splenic calculi,Splenic atrophy,Splenic malignancy,Accessory spleen
403,The following is not a feature of malignant transformation by cultured cells -,Increased cell density,Increased requirement for growth factors,Alterations of cytoskeletal structures,Loss of anchorage
404,Causative agent for Farmers' Lung is?,Thermoactinomyces sacchari,Thermophiles actinomyces,Cotton dust,Pigeon feather
405,Alpha-1 antitrypsin deficiency causes,Emphysema,Bronchitis,Bronchieactasis,Pneumonia alba
406,Linitis plastica is a type of ?,Plastic like lining of stomach,Diffuse carcinoma of stomach,Benign ulcer,GIST
407,Which of the following infections is associated with persistent neutrophil recruitment even after 24 hours of infection?,Tuberculosis,Virus,Pseudomonas,Protozoa
408,A middle aged man presented with multiple flaccid bullae and oral mucosal lesions. The most likely finding would be:,Granular IGa in reticular dermis,Fishnet IgG in epidermis,Linear IgG inderoepidermal junction,Linear IgA in dermal papillae
409,Least cariogenic among these,Raw starch,Cooked starch,Sucrose,Fructose
410,Which of the following is Pan leukocyte marker,CD19,CD3,CD45,CD45 RO
411,Principal cell in granuloma is,Lymphocyte,Histiocyte,Langhyans,Giant cell
412,Endoscopic biopsy from a case of H.pylori related duodenal ulcer is most likely to reveal -,Antral predominant gastritis,Multifocal atrophic gastritis,Acute erosive gastritis,Gastric atrophy
413,Which Antibody crosses placenta?,IgG1,IgG4,IgA,IgD
414,The typical bone marrow finding in ITP is:March 2004,Absent megakaryocytes,Foam cells,Increased megakaryocytes,Fragmented megakaryocytes
415,Which thyroid carcinoma is associated with calcitonin amyloid deposition?,Papillary,Follicular,Anaplastic,Medullary
416,"A 15 year old boy died suddenly while playing in the field. On autopsy, fibrofatty replacement of right ventricular myocardium is seen. Most likely diagnosis is:",Arrhythmogenic right ventricular dysplasia,Dilated cardiomyopathy,Hyperophic cardiomyopathy,Obstructive cardiomyopathy
417,"In Vitamin-A deficiency, cancerous lesions occur due to",Metaplasia,Dysplasia,Aplasia,Hyperplasia
418,Pigment stone is composed of?,Ca bilirubinate,Ca phosphate,Ca carbonate,Ca gluconate
419,The following pedigree represents:,Osteogenesis imperfecta,Wilson’s disease,Alkaptonuria,Cystic fibrosis
420,For which one of the following tumours Gastrin is a biochemical marker:,Medullary carcinoma of thyroid,Pancreatic neuroendocrine tumour,Pheochromocytoma,Gastrointestinal stromal tumor
421,Asbestosis is not associated with -,Ca Lung,Ascites,carcinoma esophagus,Mesothelioma
422,Which type of amyloidosis is caused by mutation of the transthyretin protein?,Familial Mediterranean fever,Familial amyloidotic polyneuropathy,Dialysis associated amyloidosis,Prion protein associated amyloidosis
423,Natural killer cells attacks which of the following cells,Cells which express MHC1,MHC cells which express MHC2,Cells which are not able to express MHC1,Cells which are not able to express MHC
424,Gingival biopsy is used for diagnosis of -,Scurvy,Sarcoidosis,Amyloidosis,SLE
425,Birbeck granules are seen in which of the following?,Eosinophils,Langerhans cells,Reed-Sternberg cells,Anitschkow cells
426,Eruption cyst,Transforms into dentigerous cyst,Regresses after eruption of the tooth,Is found in the place of the missing tooth,Is a type of dentigerous cyst
427,Genetic studies of a patient is positive for products of mic-2 gene. He may have the following condition:,Ewing's sarcoma,Osteosarcoma,Dermatofibroma protuberans D. Alveolar cell sarcoma,Alveolar cell sarcoma
428,Talon's cusp is characteristic of which syndrome,Edward's syndrome,Klinefelter's syndrome,Rubinstein -Taybi syndrome,Down's syndrome
429,Karyotyping is useful in diagnosis of -,Autosomal recessive disorders,X-linked recessive disorders,Chromosomal abnormalities,Biochemical abnormalities
430,A surgeon removed section of tissues how would he confirm that cut margin doesn't contain any suspicious tissue intraoperatively?,Punch biopsy,Brush biopsy,Frozen section,Exfoliative cytology
431,"A 45-year-old man presents with weakness and wasting of the muscles of his right hand for 8 months. Physical examination shows fasciculations of the hand. The patient's speech is impaired, and 6 years later, he dies of respiratory insufficiency. Autopsy shows atrophy of ventral roots in the spinal cord. Which of the following is the most likely diagnosis?",Amyotrophic lateral sclerosis,Gerstman Straussler-Scheinker disease,Huntington disease,Multiple infarct dementia
432,Tooth discolouration due to high biLirubin secretion is seen in the,Pink tooth of mummery,Ochronosis,Chlorodontia,Leong teeth
433,Peutz  Jeghers Syndrome has,Autosomal Recessive inheritance,Autosomal dominant inheritance,X linked Recessive inheritance,X linked dominant inheritance
434,Female treated for Urinary tract infection now has vaginal discharge. Most likely organism is,Ureaplasma urealyticum,Candida,Chlamydia,Trichomonas
435,Best site for taking biopsy for viral oesophagitis is?,Edge of ulcer,Base of ulcer,Adjacent indurated area around ulcer,Surrounding normal mucosa
436,Anthracosis is due to inhalation of,Coal dust,Asbestos dust,Silica dust,Beryllium dust
437,Commonest histological type of carcinoma testis is:(1994),Teratoma,Yolk sac tumour,Seminoma,Choriocarcinoma
438,Mutation in NPHS1 gene causes which disease?,Alport syndrome,Congenital Finnish type nephrotic syndrome,Focal segmental glomerulosclerosis,Nail patella syndrome
439,Cell surface molecules involved in peripheral tolerance induction are,B7 and CD28,CD40 and CD40L,CD34 and CD51,B7 and CD3
440,Most common site for peripheral aneurysm is:,Popliteal,Profunda femoral,Femoral,External iliac
441,"A 30 year old patient with radiographic appearance of endosteal bone formation, sclerosed bone is likely to be suffered from?",Garre's osteomyelitis,Chronic focaL sclerosing osteomyelitis,Acute osteomyelitis,Chronic osteomyelitis
442,Which of the following collagen is involved/expressed in early wound healing,Type 1,Type 2,Type 3,Type 4
443,Absent urobilinogen in urine with icterus indicates?,Perihepatic obstruction,Hemolysis,Hepatitis,Liver failure
444,Tigered effect of heart is seen in,Fatty change,Hyaline change,Amy,Atrophy
445,Which of the following has higher risk of malignancy,Leukoplakia,Erythroplakia,Dysplasia,Hyperplasia
446,A characteristic feature of Still's disease -,Prominent kidney involvement,Rashes,Positive Rheumatoid factor,Neutropenia
447,Leukemoid reaction is seen in -a) Acute infectionb) Myelomatosisc)  Hemorrhaged)  Erythroleukemiae)  Bronchogenic carcinoma,ae,bc,ad,ac
448,Normal myeloid ehyroid ratio is -,2:01,1:01,3:01,4:01
449,Which of the following findings expected on microscopic examination of biopsy from hea bowing ventricular hyperophy With asymmetric septal thickening,Aschoff bodies,Disorganisation of myofibrils,infiltration by inflammatory cells,Localised fibrous scarring
450,Microscopy which can be performed with minimum optical illumination?,Dark field,Phase contrast,Bright-field microscopy,Fluorescent microscopy
451,"An 18-year-old man moves from sea level to an elevation of 2,400 m to train as a skier. The increased requirement for oxygen delivery to tissues at the higher elevation stimulates the synthesis of a renal hormone (erythropoietin), which targets hematopoietic stem cells in the bone marrow. Erythropoietin promotes the survival of early erythroid progenitor cells primarily through which of the following mechanisms?",Altered cell-matrix adhesion,Downregulation of p53,Enhanced glucose uptake,Inhibition of apoptosis
452,Bilateral breast ca is -,Scirrhous ca,Medullary ca,Lobular ca,Ductal ca
453,Shelf life is maximum for,Whole blood,FFP,PRBC,Platelet concentrate
454,'Wireloop' lesions in kidney are seen in,DM,SLE,PAN,Scleroderma
455,"""Wire loop"" lesions in glomeruli are characteristic of:",SLE,Amyloidosis,IgA nephropathy,Nephrotic
456,Mitochondrial chromosomal abnormality leads to -,Leber's hereditary optic neuropathy,Angelman syndrome,Prader-willi syndrome,Myotonic dystrophy
457,Shingles occurs,primary infection,is unilateral,occurs on movable tissues,is bilateral
458,Most common site of salivary gland tumor is?,Parotid salivary gland,Submandibular salivary gland,Sublingual gland,Submaxillary gland
459,The chromosomal mapping indicates:,Klinefelter syndrome,Cri du chat syndrome,Eagle’s syndrome,Down’s syndrome
460,Type IV Hypersensitivity-,Farmer's lung,Contact hypersensitivity,Immediate hypersensitivity,Myasthenia gravis
461,"In Lipooxygenase pathway, the formation of the arachidonic acids products which of the following helps in the promote platelet aggregation and vasoconstriction -",C5a,Thromboxane A2,Leukotriene B4,C1 activators
462,"A 55-year-old female presents to the surgeon with breast symptoms. Her right breast is swollen, red and tender. The physician palpates a firm area in the breast and suspects inflammatory breast cancer. Which of the following best describes the histological changes observed in this disorder?",Acute inflammation in breast carcinoma,Chronic inflammation in breast carcinoma,Dermal lymphatic invasion by cancer cells,Epidermal invasion by cancer cells
463,PTH does not cause:,Maintains serum Ca2+,Ca2+ retention,Decreased PO43- excretion,May cause osteolysis
464,The Finnish type of congenital nephrotic syndrome occurs due to gene mutations affecting the following protein,Podocin,Alpha-actinin,Nephrin,CD2 activated protein
465,Sudden onset of cough followed by increasing dyspnea is characteristic of,Pleural effusion,Lobar pneumonia,Myocardial infarct,Pneumothorax
466,Treacher Collins Syndrome is,Maxiaofacial Dysostosis,MandibuLofacial Dysostosis,Maxillomandibutofacial Dysostosis,Condylar Dysostosis
467,A 70-year-old male Rohan with advanced visceral cancer dies of extensive myocardial infarction. Autopsy also reveals sterile non-destructive vegetations along the mitral leaflet edges. The pathogenesis of this patient's vegetations is most similar to that of:,Hypercalcemia of malignancy,Distant metastases,Trousseau syndrome,Raynaud's phenomenon
468,"A 68-year-old man with prostate cancer and bone metastases presents with shaking chills and fever. The peripheral WBC count is 1,000/mL (normal =4,000 to 11,000/mL). Which of the following terms best describes this hematologic finding?",Leukocytosis,Leukopenia,Neutrophilia,Pancytopenia
